Name	title	coding	mentioned_candidate	upvote_ratio	ups	score	num_comments	total_awards_received
t3_jy5c91	Trump Got Tricked by a Twitter Troll Posing as His Sister			0.97	685	685	72	0
t3_jy09dz	Opinion: Hold President Trump accountable for his misdeeds			0.99	1919	1919	54	1
t3_jycvon	Twitter to hand over @POTUS account to Biden on January 20			0.93	101	101	17	0
t3_jxq0yf	Biden Must Keep His Word and Allow Investigations of Trump to Proceed			0.97	22943	22943	717	5
t3_jygqmu	Republicans demand Michigan delay certifying Biden win for ‘audit’ of Detroit vote			0.78	49	49	46	0
t3_jxuc2q	Trump Is No Longer the Problem. His Army of Followers Is.			0.98	5165	5165	258	0
t3_jyhe14	Trump tells G20 leaders he wants to work with them ‘for a long time’			0.72	40	40	39	0
t3_jxxrc7	Georgia secretary of state certifies election results that show state’s voters chose Joe Biden for president			0.99	2604	2604	55	0
t3_jyeey7	Biden to work to end executions as government sets 3 more			0.95	74	74	3	0
t3_jyiop6	Trump attacks big Pharma, announces programs to lower drug prices			0.69	38	38	41	1
t3_jxqskc	Michigan Republican leader is meeting with Trump at White House to discuss coup			0.97	10420	10420	886	1
t3_jy4ekt	Twitter says it’s handing @POTUS account over to Joe Biden on Inauguration Day			0.95	696	696	52	0
t3_jxpd0y	Georgia Secretary of State to certify election for Biden			0.99	17505	17505	488	7
t3_jxvr8r	Biden is considering making Merrick Garland, denied Supreme Court seat, the attorney general			0.97	3475	3475	287	0
t3_jybm3w	Trump maintains unproven 'massive' fraud claim after meeting with Michigan lawmakers			0.9	100	100	32	0
t3_jxotoe	Trump’s lawsuits plagued by spelling errors: ‘I’ve never seen an election lawyer handle a case as poorly as Giuliani has’			0.98	26881	26881	1107	7
