Name	title	coding	mentioned_candidate	upvote_ratio	ups	score	num_comments	total_awards_received
t3_jymtbq	Megathread: Judge Dismisses Trump Lawsuit Seeking to Delay Certification in Pennsylvania			1.0	248	248	126	0
t3_jyhv9o	Trump was pictured on his Virginia golf course during a coronavirus meeting for G20 leaders			0.98	11278	11278	488	1
t3_jyi4xi	Impeach the president again — Removal from office wouldn’t be the goal this time. It would be to prevent Trump from running again.			0.98	7186	7186	382	3
t3_jyjecp	Wisconsin officials: Trump observers obstructing recount			0.99	4834	4834	296	1
t3_jyevov	Trump Supporters in Georgia Threaten to Destroy GOP, Boycott Runoff Elections			0.88	66062	66062	7494	98
t3_jyfn88	Trump tweets about election results and skips session on pandemic during G20			0.98	10195	10195	345	4
t3_jyebbg	GOP asks Michigan not to certify election results, citing ‘irregularities’ | The move follows speculation that Trump is seeking to persuade Michigan Republicans to override election results			0.98	12780	12780	790	3
t3_jyg71f	NAACP Federal Suit: Trump Violated Voting Rights Act			0.99	7109	7109	126	3
t3_jyd4va	Trump admits Michigan Congressmen met to discuss coup			0.95	25281	25281	1250	13
t3_jyj5z6	Detroit voters sue Donald Trump over unsubstantiated claims of voter fraud			0.99	3316	3316	46	1
t3_jydai0	Bypassing McConnell: Democrats push Biden to aggressively use executive power			0.98	12838	12838	703	1
t3_jycwb6	Meet Pennsylvania’s anger translator, and Donald Trump’s worst nightmare			0.97	13387	13387	786	12
t3_jyih12	Yes, Trump Is (Still) Engaged in an Attempted Coup; and Yes, It Might Lead to a Constitutional Crisis and a Breaking Point			0.95	3109	3109	243	0
t3_jybvym	Biden's lead over Trump surpasses 6M votes as more ballots are tallied			0.98	18287	18287	407	14
t3_jyat09	Michigan group sues Trump campaign for alleged mass voter suppression			0.9	63578	63578	1553	43
t3_jyehxb	No, Venezuelan communists did not interfere in the election. Yes, Trump’s legal team claimed that.			0.99	5280	5280	128	1
t3_jycgfg	Shame the Random, Unknown Government Officials Aiding Trump’s Coup Attempt			0.99	6640	6640	79	0
t3_jyarxl	Neal Katyal: All of Trump’s criminal immunity expires in about 60 days			0.98	11496	11496	396	6
t3_jyacke	"Rudy Giuliani's quixotic frenzy has observers wondering if he may need Trump's protection | ""One explanation? He needs a pardon and he's trying to earn it,"" a CNN analyst says"			0.98	13241	13241	568	1
t3_jyk8mk	‘My Frustration Turned Into Anger.’ Some Americans Who Lost Family Members to COVID-19 Have Turned Against Donald Trump			0.98	1430	1430	142	0
t3_jybdm3	Trump Takes Another L: Michigan GOPers Say No To Election Steal			0.98	7918	7918	215	0
t3_jy9p0n	Trump's defeat by Joe Biden has triggered a huge wave of relief among the United States' European allies			0.89	48257	48257	2091	25
t3_jygbaz	GOP Michigan ex-governor says state board will certify Biden winner over 'bully' Trump			0.99	2766	2766	83	0
t3_jyd46w	Trump has longstanding history of calling elections 'rigged' if he doesn’t like the results			0.99	4353	4353	109	0
t3_jyegwu	Wall Street Journal Bails on Trump’s ‘Conspiracy Theory,’ Says Giuliani is Not a ‘Serious Practicing Attorney			0.99	3361	3361	55	0
t3_jyjcxb	Wisconsin officials: Trump observers obstructing recount			0.98	1305	1305	62	0
t3_jyaacw	Kayleigh McEnany’s Latest Trump Lie Is Firmly Debunked In Viral Video			0.98	8144	8144	473	1
t3_jy8q5v	NJ Democrat Calls for Rudy Giuliani, Other Trump Attorneys to be Disbarred			0.9	50513	50513	1315	17
t3_jyjnr1	Trump Campaign Lawyers File New Pennsylvania Motion Which Misspells Governor’s Name			0.99	1115	1115	93	0
t3_jyamtf	Barack Obama: ‘Donald Trump and I tell very different stories about America’			0.98	5114	5114	169	0
t3_jyevyz	Biden's popular vote lead over Trump stretches to more than 6m			0.99	2111	2111	56	1
t3_jyftsx	Trump’s Pennsylvania Suit is ‘Incoherent Conspiracy,’ Voters Say			0.99	1583	1583	48	0
t3_jy93rj	Dear Trump supporters: Those who egg on the president now, given the damage he does to America, are truly reprehensible			0.98	6699	6699	280	0
t3_jyirvl	‘Do they just not care?’ Miami immigrants troubled by surge of Latino support for Trump			0.97	877	877	94	0
t3_jyhrl0	Trump skips G20 pandemic event to visit golf club as virus ravages US			0.98	1037	1037	70	0
t3_jygnzl	A group of Michigan voters are suing the Trump campaign for disenfranchising Black voters, lawsuit alleges			0.99	1242	1242	15	0
t3_jybo0y	Yes, Donald Trump claimed fraud after the 2016 Iowa caucuses			0.98	2892	2892	49	0
t3_jyc40v	With Trump sabotaging American democracy, the Russians don’t need to interfere			0.98	2644	2644	95	0
t3_jyd52j	Twitter to Meet With Biden Transition Team on Transfer of Social Media Accounts From Trump Admin			0.99	2171	2171	83	0
t3_jyi19h	Trump Is Staging a Comically Incompetent Coup — It would almost be possible to laugh at this debacle if the stakes weren’t so serious.			0.98	916	916	41	0
t3_jyk59x	Wisconsin officials: Trump observers obstructing recount			0.98	591	591	53	0
t3_jya174	Judge slaps down Trump appointee who has sought to reshape Voice of America and related agencies			0.99	3725	3725	32	0
t3_jyj7a6	Michigan Democrats are taking a stand against Trump's campaign to steal the state's vote			0.98	648	648	18	0
t3_jyljff	Joy Reid: It looks like Republicans 'want to hand Biden mega crises' and a country that's broken			0.97	420	420	54	0
t3_jykr5a	Wisconsin Officials: Trump Observers Obstructing Recount			0.99	458	458	43	0
t3_jyl6wx	"""Pathetic"": Geraldo Rivera mocked by TV anchors for suggesting ""The Trump"" as name for COVID vaccine"			0.96	399	399	87	0
t3_jyhdoi	Trump tweets undermine Michigan leaders; images show Chatfield drinking at Trump hotel			0.97	788	788	36	0
t3_jy9p2e	Steve Mnuchin Is Doing His Part to Sabotage the Biden Administration on His Way out the Door			0.98	3371	3371	110	0
t3_jyfjeg	Most GOP Senators Stay Mum on Trump's Efforts to Challenge Election, After Washington Post Contacted All 53 of Them			0.97	1023	1023	39	0
t3_jybnek	Trump tries to drum out GOP election officials who won’t play his games — Georgia Secretary of State Brad Raffensperger's family has received threats and he expects a primary challenge in 2022			0.98	2029	2029	75	0
t3_jyfk0g	"Sen. Bernie Sanders: ""Thank God"" Joe Biden won the election"			0.97	992	992	69	0
t3_jyhg8l	Trump appointed judges in Florida overturn ban on conversion therapy for minors			0.97	702	702	82	1
t3_jykgfn	Black Detroit voters sue Trump campaign over effort to invalidate election results			0.98	403	403	15	0
t3_jyk4r9	Liz Cheney: Trump should respect ‘the sanctity of our electoral process’			0.96	427	427	40	0
t3_jyix42	Trump does not participate in G-20 event on global pandemic preparedness			0.98	484	484	40	0
t3_jyhjr0	Trump skips G20 coronavirus meeting to play golf and tweet bogus election claims			0.97	613	613	48	0
t3_jyj74r	Judge bars Trump appointee from interfering in Voice of America			0.98	444	444	9	0
t3_jye7eu	"In 'Tremendous Rebuke' of Trump Appointee, Federal Judge Bars US Media Agency Head From Interfering in News Coverage | ""Michael Pack has repeatedly and intentionally violated the First Amendment rights of VOA journalists."""			0.99	974	974	11	0
t3_jyku4y	'Like Politicizing Toilet Paper': Biden COVID Adviser Slams Politicization of Masks			0.98	303	303	31	0
t3_jyefvb	Donald Trump says 'I won, by the way' and lashes out at Pfizer claiming it delayed news of the COVID-19 vaccine until after the election			0.95	845	845	96	0
t3_jy9asn	Let's count the ways Donald Trump has tried to subvert this election, shall we?			0.98	2374	2374	76	1
t3_jyk5l1	The Desperate Final Gasps of Team Trump’s Flailing ‘Mini-Coup’			0.96	304	304	50	0
t3_jyh4cs	As world leaders meet to talk pandemic, Trump checks out and hits the links			0.96	521	521	45	0
t3_jyj43l	Michigan Group Sues Trump for Disenfranchising Black Voters			0.98	362	362	6	0
t3_jyg34p	Trump Using Last Days to Lock in Policies and Make Biden’s Task More Difficult			0.96	599	599	76	0
t3_jylwcb	Wisconsin county election officials accuse Trump observers of obstructing recount			0.97	203	203	25	0
t3_jybv6o	Will Trump Screw Up Republican Efforts to Hang Onto the Senate?			0.98	1196	1196	140	0
t3_jy3mhv	Biden's margin of victory over Trump surpasses 6 million votes			0.98	19086	19086	671	10
t3_jyi47r	Trump Skips G20 Pandemic Preparedness Meeting as Covid-19 Cases Surpass 12 Million in US			0.97	391	391	25	0
t3_jygs2r	G20 leaders meet to discuss help for poorest nations in post-Covid world, Trump golfs			0.97	495	495	37	0
t3_jyecom	Rahm Emanuel Reportedly Being Considered for Biden's Cabinet, a Choice That Would Be a Slap in the Face to Black Voters			0.9	693	693	76	0
t3_jyhqa5	Trump’s failure to work with Biden is becoming more urgent as Covid spreads			0.97	397	397	10	0
t3_jy58b1	Senators who urged ‘voters to decide’ impeachment won’t admit Trump lost the election			0.98	7180	7180	121	0
t3_jyiofw	Sen. Graham says Biden should have access to classified intelligence briefings			0.93	333	333	58	0
t3_jyeurt	Merrick Garland is being considered for Attorney General in the Biden administration			0.95	600	600	84	0
t3_jycdqu	Why Can Trump Try To Steal The Election? Blame The Electoral College.			0.97	919	919	74	0
t3_jyeldv	A new lawsuit alleges Trump’s effort to overturn Michigan’s election results disenfranchises Black voters			0.98	611	611	26	0
t3_jyi5ye	Trump goes golfing in middle of G20 summit			0.96	336	336	32	0
t3_jyjt9q	Battered by failures to reverse Biden win, Trump, allies persist with fraud claims			0.96	239	239	21	0
t3_jyc5ef	Trump options narrow as Michigan backs Biden win			0.96	888	888	82	0
t3_jyl6g3	Let Trump Off the Hook in the Name of Elusive Unity? Some Critics Say That Could Be a Big Mistake			0.93	181	181	52	0
t3_jyle31	'Certify the Results!': GOP Michigan Lawmakers Blasted for 'Legitimizing a Fascist Coup Attempt' by Meeting With Trump			0.95	173	173	5	0
t3_jy7n7y	Conservative News Site Warns Trump: 'Concede And Move On'			0.98	2748	2748	153	0
t3_jyhutc	Obama jokes that Navy SEALs could remove Trump from the White House			0.95	317	317	98	0
t3_jyktn9	Trump playing Golf instead of cooperating to fight the Coronavirus Pandemic			0.95	183	183	28	0
t3_jylkfc	Wisconsin officials: Trump observers obstructing recount			0.93	156	156	17	0
t3_jy30hq	U.S. Sen. Marsha Blackburn, a Trump ally, refers to Biden as 'president-elect'			0.97	11808	11808	509	0
t3_jyf2se	Georgia GOP governor says he understands Trump's frustration, but maintains he's following state laws			0.97	500	500	38	0
t3_jyauqo	Conspiracy theories are Trump ‘weapons’ in desperate bid to cling to power			0.97	1014	1014	25	0
t3_jy1h8p	Twitter says it will give @POTUS account to Biden on Inauguration Day			0.87	79264	79264	2704	56
t3_jy2k5b	Michigan attorney general ponders criminal probes of state and local officials who bend to Trump’s will on overturning election results			0.98	10402	10402	269	1
t3_jyht3y	Pompeo’s Grotesque Farewell Party in Israel Shows That the Trump Team Knows It's Over — Pompeo used his visit to Israel and the settlements to push forward his pet ideological project and advance his post-Trump political career.			0.94	273	273	13	0
t3_jyh7e5	Cuomo tells Biden $500 billion in stimulus funds needed to bail out states			0.97	295	295	31	0
t3_jyk7x7	Trump campaign again seeks to stop certification of Pennsylvania's election results			0.93	172	172	48	0
t3_jy853m	US Chamber of Commerce chief calls on Trump to stop delaying transition to Biden presidency			0.98	1847	1847	37	0
t3_jy94n0	Trump considers targeting birthright citizenship with executive order in his last weeks in office, report says			0.97	1335	1335	278	1
t3_jymfwh	Wisconsin election officials say Trump observers obstructing recount, some ‘clearly don’t know what they are doing’			0.99	105	105	10	0
t3_jy2blr	Steven Mnuchin Swears He’s Not Tanking the Economy Just to F--k Over Joe Biden: Strangely, not everyone believes him.			0.98	9221	9221	287	1
t3_jyca1s	The Trump campaign’s much-hyped affidavit features a big, glaring error			0.98	635	635	94	0
t3_jyl5yg	Donald Trump Is Leaving Behind Blueprints to End Democracy - And I fear there’s no going back			0.91	132	132	21	0
t3_jyjvqh	'A Disgrace': Trump's DOJ Schedules Three More Federal Executions in Days Before Anti-Death Penalty Biden Takes Office			0.92	168	168	37	0
t3_jy0een	Rudy Giuliani's Son Potentially Exposed Most of Trump's Legal Team to COVID During RNC Press Conference			0.98	20578	20578	697	5
t3_jy06aa	After Trump meeting, Michigan GOP lawmakers say they’re not aware of any info that would change Biden’s victory in state			0.97	26089	26089	981	13
t3_jy38ap	Biden will receive @POTUS Twitter account on Jan. 20 even if Trump doesn't concede, company says			0.97	6151	6151	237	0
t3_jyl2mf	Trump skipped a coronavirus meeting with G20 leaders to play golf			0.94	122	122	16	0
t3_jyi6td	Trump steps on Michigan lawmakers' message in tweets after meeting			0.94	214	214	72	0
t3_jyl1vt	Michigan GOP legislators appear at Trump Hotel after White House meeting			0.97	120	120	11	0
t3_jy2j68	Arizona’s largest county certifies Biden win over Trump			0.99	7131	7131	72	0
t3_jymexa	RNC Backs Trump's Bogus Claims That He Won the Election			0.93	84	84	16	0
t3_jy0o3b	Michigan and Georgia Republicans Just Crushed Trump’s Coup Dreams			0.98	11412	11412	425	3
t3_jyemqz	Donald Trump Will Lose One Of His Twitter Accounts To Joe Biden On Inauguration Day. An account the president uses to retweet his conspiracy theories and vitriol will be wiped and handed over to the Biden administration.			0.96	342	342	27	0
t3_jygefw	Who needs Russia? Loudest attacks on US vote are from Trump			0.96	252	252	11	0
t3_jy1qop	After Trump meeting, Michigan GOP leaders say Biden's win still stands			0.99	7525	7525	209	3
t3_jy46k6	Letters to the Editor: Stop Donald Trump's coup. Impeach him again			0.98	3890	3890	213	0
t3_jyga4y	Judge rules against Trump global media chief after firings			0.97	249	249	3	0
t3_jyjx9m	Romney vs. Chachi? Actor Scott Baio threatens to run against Utah senator in 2024 over Trump rebuke.			0.87	111	111	73	0
t3_jy0iwa	Twitter will hand @POTUS to Biden on Inauguration Day, even if Trump doesn’t concede			0.98	8292	8292	313	3
t3_jyj6sy	AP Fact Check: Trump's flailing effort resting on mendacity			0.96	124	124	7	0
t3_jyaidt	The Danger (and Ineptitude) of Trump’s Failed Coup			0.98	564	564	16	0
t3_jyfwel	Analysis: How Georgia proves Trump has no chance of winning			0.96	211	211	21	0
t3_jyj6r2	Judge rules against Trump global media chief after firings			0.95	116	116	1	0
t3_jyc1ze	Voice of America's 5 Months Under Trump CEO: Lawsuits, Bias Claims, And A Sex Scandal			0.98	395	395	10	0
t3_jyl201	A vindictive Trump seeks to undermine Biden’s presidency			0.95	84	84	9	0
t3_jyi1mt	"Trump campaign ""seeking to disenfranchise Black voters"" with election fraud claims: lawsuit"			0.96	143	143	6	0
t3_jydi88	The Fed Could Help Cash-Strapped Cities and States. Mnuchin Has Other Ideas. | The lame-duck Treasury secretary seems to want to sabotage Biden’s ability to stave off the pandemic’s economic impacts.			0.97	301	301	15	0
t3_jy9t3x	Biden will receive @POTUS Twitter account even if Trump refuses to concede			0.96	616	616	62	0
t3_jyhkqu	Judge rules against Trump global media chief after firings			0.97	145	145	5	0
t3_jyby64	Business and World Leaders Move On as Trump Fights to Reverse Election | President-elect Joseph R. Biden Jr. is seizing the moment, not to aggressively confront the president he defeated, but to act presidential in his stead.			0.98	384	384	12	0
t3_jyl2il	Joe Biden wants a $15 minimum wage — here’s what’s standing in his way			0.94	81	81	25	0
t3_jxxkww	Bernie Sanders says the 'GOP has ceased to be a political party' and 'is now a cult' for staying silent on Trump's election attacks			0.87	68220	68220	1982	40
t3_jyd786	Trump supporters plan D.C. rally two days before electoral college votes are cast			0.93	299	299	104	0
t3_jxz8g9	Georgia governor certifies presidential electors for Biden			0.99	8826	8826	250	1
t3_jxxiya	Trump refuses to take questions after falsely claiming he won election in first media appearance in weeks. No sitting US president has falsely claimed an election victory from the Brady Briefing Room. Until Friday			0.97	18486	18486	904	1
t3_jyj1x6	'GOP made a bed of nails': Scaramucci on Republicans appeasing Trump			0.9	114	114	15	0
t3_jykoxb	Pete Buttigieg May Be Contender For Biden’s Cabinet | NBC News NOW			0.81	79	79	53	0
t3_jyau1p	GOP lawmaker patience runs thin with Trump tactics			0.97	446	446	45	0
t3_jy4cdz	Michigan group sues Trump campaign citing disenfranchisement of Black voters - The plaintiffs say the campaign's legal challenges to the election violated their voting rights.			0.99	2444	2444	56	0
t3_jybvp1	Twitter will give @POTUS handle to Joe Biden on Inauguration Day			0.96	340	340	27	0
t3_jydlai	Biden to Work to End Executions as Government Sets 3 More			0.96	247	247	40	0
t3_jy8vfz	Fareed Zakaria: Trump presidency is stomping on the face of democracy forever			0.98	673	673	26	0
t3_jye8sy	Latinas for Trump founder unseated Florida Democrat after seeing ‘shadow candidate’ enter race			0.96	218	218	5	0
t3_jxwbg1	Trump accuses Pfizer and Moderna of working to stop his re-election			0.92	55301	55301	3734	33
t3_jy38k5	CNN's Brianna Keilar rolls the tape on Donald Trump's history of baselessly claiming election fraud			0.99	2872	2872	68	1
t3_jy0jkm	Trump Is Still Raging Against Democracy. But It’s Time To Applaud The Tenacity Of Voters, Poll And USPS Workers			0.99	5110	5110	49	0
t3_jyjoh2	Election 2020 updates: Michigan GOP Speaker Chatfield drinks at Trump Hotel; Carson was 'desperately ill' from COVID			0.91	80	80	3	0
t3_jymdi0	President-elect Joe Biden’s transition team is one of the most diverse ever Biden wants his administration to “look like America.” His transition team is a start.			0.9	46	46	8	0
t3_jyfwyr	GOP Sen. Blackburn Calls Biden President-Elect, but Later Takes it Back			0.92	153	153	36	0
t3_jykt2t	Trump forges ahead with frantic effort to overturn election | Having exhausted many of his legal options, Trump is looking at other ways to subvert Joe Biden’s victory.			0.94	61	61	11	0
t3_jygj58	Joe Biden Turns 78 and Will Be the Oldest President — After Trump Broke the Record Right Before Him			0.87	132	132	37	0
t3_jyh2tm	Trump's 'Death Star' strategy: Forcing a fight over states' electors			0.94	120	120	38	0
t3_jy5qo8	Biden's margin of victory widens as Trump's subversion efforts grow more frantic			0.98	1440	1440	86	0
t3_jy0zg7	Editorial: Trump’s effort to steal the election is a step toward fascism in America. If you call yourself a patriot, you can’t support it			0.98	4053	4053	120	0
t3_jxv4xn	More GOP Senators Have COVID Than Have Acknowledged That Joe Biden Won			0.9	76173	76173	1614	42
t3_jyg473	Battered by setbacks in push to reverse Biden win, Trump persists with fraud claims			0.94	137	137	25	0
t3_jyiov7	For Netanyahu and Israel, Trump’s Gifts Kept on Coming. Allowing the convicted spy Jonathan Pollard the ability to emigrate to Israel was just the latest in a long list of prizes for America’s closest ally in the Middle East.			0.9	80	80	10	0
t3_jxvrvz	Nancy Pelosi calls Trump a 'psychopathic nut' as the president continues to try to overturn the election results			0.97	14568	14568	524	5
t3_jym2qo	Duty or Party? For Republicans, a Test of Whether to Enable Trump			0.94	43	43	5	0
t3_jxybf2	'Certify the Results!': Michigan Lawmakers Blasted for 'Legitimizing a Fascist Coup Attempt' by Meeting With Trump			0.98	6225	6225	172	1
t3_jy79iv	Trump’s monumental sulk: president retreats from public eye as Covid ravages US | Two weeks after his defeat, Trump has gone from always present to effectively missing, behavior that many say is an unprecedented and dangerous			0.97	818	818	117	1
t3_jye1kw	Justice Dept. meets Trump, Giuliani vote-fraud claims with silent skepticism			0.96	168	168	12	0
t3_jylq42	Trump Orders Hasty Afghanistan, Iraq Drawdowns to Beat Biden Inauguration			0.88	40	40	28	0
t3_jxu6uj	Georgia certifies that Joe Biden won the recount			0.98	23374	23374	372	12
t3_jy9z3h	Trump tries to leverage power of office to subvert Biden win			0.96	355	355	16	0
t3_jye2au	No Take Backs! Blackburn Spox Says GOPer Didn’t Mean To Call Biden President-Elect			0.94	157	157	24	0
t3_jygnh6	Here’s when Biden’s win becomes official — and how Trump is trying to prevent that | With key deadlines looming, derailing the certification of results is part of the president’s strategy			0.96	101	101	37	0
t3_jykdgu	Trump denies Georgia's results after hand recount; prompts concerns over January's Senate runoff			0.8	52	52	28	0
t3_jyibg1	Trump addresses virtual G-20 summit, heads out before session on pandemic			0.88	70	70	15	0
t3_jyfd5c	I met ‘monster’ reality TV star Donald Trump 16 years ago. The reality of him has been monstrous . . .			0.92	120	120	14	0
t3_jxwnu3	Detroit asks judge to sanction Trump campaign for spreading 'disinformation'			0.99	7241	7241	43	0
t3_jxyoqs	The Perils of Not Prosecuting Trump Joe Biden is wary of a legal reckoning against his predecessor, but to let Trump go would be to sanction future corruption.			0.99	4697	4697	198	2
t3_jyiblz	Republican Resistance Looms in the Senate for Biden’s Nominees			0.84	72	72	37	0
t3_jyjz6o	Trump privately plots his next act - including a potential 2024 rematch			0.77	50	50	71	0
t3_jxuobg	Trump's legal team seemingly didn't notice its allegation of election fraud in Michigan is based on data from Minnesota			0.99	12059	12059	353	1
t3_jykqsr	Trump's Michigan election ploy: How it works, and why experts say it will fail			0.8	40	40	5	0
t3_jy2fn8	President-elect Joe Biden Asks Public to Fund Transition as Trump Refuses to Concede			0.98	2071	2071	224	0
t3_jxtgbd	Trump’s press secretary Kayleigh McEnany heckled in briefing: ‘When will you admit you lost?’			0.89	44622	44622	2379	18
t3_jyewe9	Plagued by COVID outbreaks, the meatpacking industry could be forced to change under Biden			0.96	118	118	4	0
t3_jyfthv	Twitter will transfer presidential accounts to Joe Biden on Inauguration Day			0.87	95	95	15	0
t3_jy8elg	Most Republicans greet Trump’s push to overturn the election with a customary response: Silence			0.98	443	443	35	0
t3_jxyws8	Republican leaders swore an oath to defend the Constitution. That means telling Trump it’s over.			0.99	3985	3985	55	0
t3_jyedlw	Biden team solicits donations to fund presidential transition as Trump administration blocks federal money			0.95	120	120	19	0
t3_jy2mf4	Anger builds in Black community over Trump’s claims of voter fraud in big cities			0.98	1860	1860	67	0
t3_jygf1z	Biden could announce Cabinet picks as soon as next week			0.93	86	86	6	0
t3_jyhazf	Trump's monumental sulk: president retreats from public eye as Covid ravages US			0.91	67	67	10	0
t3_jydvyu	How Georgia's pro-Trump election chief became the bane of the GOP			0.96	129	129	32	0
t3_jycskf	Paris agreement gets 'new lease on life' under Biden, climate advocates say			0.97	146	146	15	0
t3_jyfrde	Senator Shirkey and Speaker Chatifeld’s names projected on Trump International Hotel			0.93	87	87	10	0
t3_jxsa0k	Merrick Garland Among Biden Candidates For Attorney General, Sources Say			0.96	19202	19202	1349	5
t3_jyek1t	Trump’s last-ditch efforts to overturn results fail to make dent in Biden victory			0.96	113	113	22	0
t3_jxwqi6	'Call his bluff': Edward Norton lays out poker-style Trump analysis we never expected			0.98	5010	5010	334	9
t3_jxz6rl	White Nationalist Appointed by Trump to Holocaust Commission Praised Jeffrey Epstein for Not Being “a Pussy”			0.98	3104	3104	110	0
t3_jxthva	Georgia Secretary of State Certifies Biden’s Win After Audit			0.99	9779	9779	187	2
t3_jye9pq	What to make of more than 70m Americans who voted for Trump? — As of today, 73,781,603 people voted for Trump, which amounts to 47.2 percent of the total votes counted.			0.9	96	96	65	0
t3_jymptl	Wisconsin officials: Trump observers obstructing recount			0.69	20	20	8	0
t3_jyee44	Trump to lose @POTUS Twitter account on January 20			0.89	96	96	11	0
t3_jxrln3	Hoyer on Trump election challenges: 'I think this borders on treason'			0.98	19927	19927	632	8
t3_jymnby	Biden Considering Lisa Monaco, Sally Yates For Attorney General			0.89	22	22	8	0
t3_jygf7w	Twitter will hand @POTUS account to Biden on Inauguration Day			0.82	69	69	22	0
t3_jymhl2	Experimental drug given to Trump to treat covid-19 wins FDA clearance			0.8	23	23	9	0
t3_jxrbox	Republican Senator Lamar Alexander urges Trump to begin Biden transition			0.98	19939	19939	512	2
t3_jykpz9	The Cabinet Appointments That Really Matter In The Incoming Biden Administration			0.8	28	28	1	0
t3_jycumy	How Members of Anti-Immigrant Extremist Groups Have Worked Closely with — and Joined — the Trump Administration			0.94	122	122	5	0
t3_jyll6a	Trump’s State Department to defund international non-profits that support BDS			0.82	28	28	6	0
t3_jy3a7r	After Trump meeting, Michigan GOP lawmakers affirmed Biden will win the state and urged Trump to focus on the COVID-19 pandemic currently ravaging the US			0.98	1238	1238	88	0
t3_jxs3ay	Trump Camp Outraged Georgia Recount Counted The Votes			0.99	12347	12347	440	0
t3_jyhbq0	Biden faces a race against the clock for U.S. to rejoin Iran nuclear deal			0.89	54	54	10	0
t3_jya79l	People Think Mnuchin Accidentally Said Trump Admin’s Most Honest Thing About COVID-19			0.93	209	209	26	0
t3_jygps8	Trump nominee's long road to Fed may be dead end			0.89	62	62	5	0
t3_jyeh3g	Trump’s last-ditch efforts to overturn results fail to make dent in Biden victory			0.93	84	84	6	0
t3_jybvbl	Analysis: With silence, GOP enables Trump's risky endgame			0.96	136	136	11	0
